asin,title,description,imUrl
B000052YAD,Crest Glide Dental Floss,Dentist recommended brand. Shred resistant. Effectively removes plaque. Experience the Glide difference. Silky smooth texture slides easily between teeth. Effectively removes tough plaque between teeth and just below the gum line.,http://ecx.images-amazon.com/images/I/51VrwgmbJhL._SY300_.jpg
B000052YAK,"Reach Dental Floss, Unwaxed/Unflavored, 55 yd (50.2 m)",The one dentists use most. ADA Accepted (American Dental Association). Dentists recommend regular flossing. Flossing has been clinically proven to remove plaque between teeth to help prevent gum disease.,http://ecx.images-amazon.com/images/I/51P5E0X44PL._SY300_.jpg
B000052YBA,Oral B Super Floss Pre-Cut Strands-50 ct,"Please note: Due to product improvements, the image shown may temporarily appear different from the product received.Stiffened end to thread floss under appliances.Spongy floss to clean around appliances and in wide spacesRegular floss to remove plaque under gumline50 Pre-Cut StrandsQuestions? Comments? 1-800-566-7252",http://ecx.images-amazon.com/images/I/311VWVP022L.jpg
B000052YBV,Cushion Grip Thermoplastic Denture Adhesive - 1 oz,"One application holds dentures up to 4 full days!Cushion Grip Denture Adhesive controls loose dentures by reducing looseness and shifting and a single application lasts up to 4 days of daily cleaning, soaking and brushing. Won't wash off in water. Even after repeated cleaning, Cushion Grip Denture Adhesive remains soft and pliable. Recreates a secure seal each time you reinsert your dentures. Cushion Grip Denture Adhesive is SAFE for all plastic and porcelain plates.Cushion Grip Denture Adhesive lets you control loose dentures so you can feel comfortable and secure.",http://ecx.images-amazon.com/images/I/41NSMRMGMWL._SX300_.jpg
B000052YAZ,Mentadent Medium Full Head Toothbrush - 1 ea (colors may vary),1)Flared Side Bristlesto massage and stimulate gums2)Multi-Level Interior Bristlesto effectively clean teeth3)Rubber Gripto enhance control,http://ecx.images-amazon.com/images/I/21eq84FNwsL.jpg
B000052XWZ,Dr. Scholl's Massaging Gel Ball of Foot Cushions 1 pr,"Dr. Scholl's Gel Ball of Foot Cushions are made with a technologically advanced, soft polymer gel, guaranteed not to rupture or leak! These Ball of Foot Cushions reduce painful pressure while comforting and soothing the sensitive ball of foot area. Made with a soft, absorbent topcloth.",http://ecx.images-amazon.com/images/I/41GDQP55VNL._SY300_.jpg
B000052XXJ,"Dr. Scholl's Pedicure Essentials Soap'n Soak Instant Foot Bath, Packets - 4 ea","Soothing foot bath softens dry, rough skin and relaxes tired, aching feet.Pamper your tired, tender feet with this lightly scented, easy to use foot bath. Just add a packet of this special formula to warm water and start soaking away foot discomfort. Your feet will feel refreshed, relaxed, revitalized. Dr. Scholl's&reg; Pedicure Essentials&reg; Soap'n Soap&reg; is the perfect &quot;pick-up&quot; at the end of a busy day.Made in U.S.A.",http://ecx.images-amazon.com/images/I/4114046HZML._SY300_.jpg
B000052YCF,"Sea-Bond Denture Adhesive, Lowers - 15 ea",DENTURE/TOOTH CARE,http://ecx.images-amazon.com/images/I/51zeAGFoOwL._SY300_.jpg
B000052YA7,"Colgate Plus Bi-Level, Soft Full Head Toothbrush - 1 ea",&lt;P&gt;&lt;STRONG&gt;Bi-Level Bristles.&#xA0; Cleans Between Teeth.&lt;/STRONG&gt;&lt;/P&gt; &lt;P&gt;Fits your teeth&#xA0;and&#xA0;mouth to get your teeth really clean.&lt;/P&gt; &lt;UL&gt; &lt;LI&gt; &lt;DIV&gt;Two levels of bristles fit the contours of your teeth to clean the surface and between.&lt;/DIV&gt; &lt;LI&gt; &lt;DIV&gt;Diamond Shaped Head narrows at tip for easy access to back teeth.&lt;/DIV&gt; &lt;LI&gt; &lt;DIV&gt;Rubber gripped handle for better control.&lt;/DIV&gt; &lt;LI&gt; &lt;DIV&gt;End rounded bristles to protect enamel and gums.&lt;/DIV&gt;&lt;/LI&gt;&lt;/UL&gt; &lt;P&gt;Dentists & Hygienists recommend replacing your toothbrush every 3 months.&lt;/P&gt; &lt;P&gt;Colors may vary.&lt;BR&gt;Made in USA.&lt;/P&gt;,http://ecx.images-amazon.com/images/I/11AW1NMMJ1L.jpg
B000052YBR,"Tek Professional Medium Straight Toothbrush, Colors May Vary",Tapered head for easy access to back teeth. Curved handle conforms to your hand for comfort and control. Easy grip handle/thumb rest for better control. End-rounded DuPont nylon bristles to help protect tooth enamel and gums. StraightMedium - Colors will vary,http://ecx.images-amazon.com/images/I/11MXTPZGBVL.jpg
B000052YAU,Reach Easy Slide Mint 40 yards,Floss for tight teeth is mint flavored and waxed.,http://ecx.images-amazon.com/images/I/21SJWHRY14L.jpg
B000052YAN,"Reach Dentotape Extra Wide Unflavored Floss, Waxed, 100yds",Extra wide cleaning surface. ADA Accepted - American Dental Association. The floss dentists use most. Dentotape ribbon floss gives you extra cleaning surface for effective plaque removal. Flossing has been clinically proven to clean away the plaque from between teeth that brushing and rinsing can't remove. Made in USA.,http://ecx.images-amazon.com/images/I/41GZJWF0V2L._SY300_.jpg
B000052Y44,BD Home Sharps Container - 1 ea,The B-D Home Sharps Container is a leak-proof and puncture-resistant container designed for the disposal of used insulin syringes and lancets. The B-D Home Sharps Container is a convenient and safe way to dispose of syringes and lancets that helps protect your family and the environment.,http://ecx.images-amazon.com/images/I/31GJeyVZZZL.jpg
B000052Y8Z,Dentemp O.S. One Step Filling Material - 1 ea,"Dentemp O.S. One Step Filling Material Replaces lost fillings and cements loose caps, crowns and inlays until you can see your dentist. Dentemp O.S. One Step Filling Material Secures loose crowns. No mixing. Safe to eat on. Instant Pain relief formula. This is a temporary remedy meant to replace a lost filling or inlay until you have a chance to visit your dentist. Made in Italy.",http://ecx.images-amazon.com/images/I/212HJTRD64L.jpg
B000052XXM,Dr. Scholl's Odor Destroyers Super Comfort Insoles - 1 pr,"Concentrated layer of ultra-effective activated charcoal absorbs and neutralizes unpleasant odors.Insoles absorb perspiration to keep feet fresh, dry and comfortable all day.Durable foam constriction provides long lasting comfort and protection.Deodorizing action continues even after you take shoes off.",http://ecx.images-amazon.com/images/I/41gWHOFMZeL._SY300_.jpg
B000052Y62,"Afta After Shave Skin Conditioner, original - 3 oz, (Pack of 12)","Not greasy, oil free. Reduces skin irritation caused by shaving. Doesn't clog razor. Easy to apply; not runny or messy. Gives a closer, smoother shave. Formulated with skin conditioners - Ideal for sensitive skin.",http://ecx.images-amazon.com/images/I/41AJwjSaJTL._SY300_.jpg
B000052YCG,"Sea Bond Denture Adhesive, Original, 15 uppers per Pack, (Case of 6)","All day hold. Ultimate fit and comfort. Total confidence. No ooze or mess like pastes. Cleaner: Thin, soft, no-mess wafer: clean-up's a breeze. Better: Guaranteed to hold all day, for comfort and confidence. Smarter: Tiny green dots of Dentsym help end denture breath. Made in USA.",http://ecx.images-amazon.com/images/I/51PNYhLmwlL._SY300_.jpg
B000052YER,"Sominex Night-Time Sleep Aid, Original Formula, 72 tablets",Diphenhydramine. Wake rested and refreshed. Doctor-preferred sleep ingredient. Made in the U.S.A.,http://ecx.images-amazon.com/images/I/119YBWMQY5L.jpg
B000052YA2,Butler G-U-M Travel Toothbrushes with Antibacterial Bristles - 2 ea,Easy To Carry,http://ecx.images-amazon.com/images/I/114HWV29Y5L.jpg
B000052Y9X,"Butler G-U-M Gum Stimulator - 600R,1 Ea","Butler G-U-M Gum Stimulator professionally designed to promote healthy, firm gums. With rubber tip stimulator for gingival massage and interdental cleaning.",http://ecx.images-amazon.com/images/I/11HEEVZJH9L.jpg
B000052Y6B,Old Spice by Procter &amp; Gamble for Men 6.37 oz After Shave Pour,"Splash it on face and neck...after shaving, after shower or whenever you want to feel cool and refreshed.IngredientsSD Alcohol 39-C, Water, Propylene Glycol, Fragrance, Benzyl AlcoholWarningsFlammableDo not apply near flame or while smokingKeep out of reach of childrenAvoid getting in eyes",http://ecx.images-amazon.com/images/I/21ZHqTMDNIL.jpg
B000052YB8,"Oral-B Interdental Refills, Tapered, 6-pack","Interdental Refills, Tapered",http://ecx.images-amazon.com/images/I/21WTDM1J8KL.jpg
B000052YC4,Fixodent Complete Fresh Mint Denture Adhesive Cream 2.4 Oz,,http://ecx.images-amazon.com/images/I/41KLKWrlGyL._SX300_.jpg
B000052Y65,BRUT SPLASH-ON Lotion For Men 7 OZ,BRUT Splash-on Lotion is a lightly scented version of the Classic BRUT scent that is designed for all over use.,http://ecx.images-amazon.com/images/I/414KE9NTNZL._SY300_.jpg
B000052YAI,"Reach Dental Floss, Waxed, Mint 200 yds",The one dentist use most. Better than ever. Slides more easily. Extra shred resistant. ADA (American Dental Association) accepted. The floss dentists use most. Dentists recommend regular flossing. Flossing has been clinically proven to remove plaque between teeth to help prevent gum disease.,http://ecx.images-amazon.com/images/I/21RKG2QGJKL.jpg
B000052XKL,"Naturalamb Natural Skin Condoms, Lubricated, 10 condoms","No latex allergens. The No. 1 natural skin condom for a more sensual feeling. This product is intended to help prevent pregnancy. It does not protect against HIV infection (AIDS) and other Sexually Transmitted Diseases (STDs). In order to help reduce the risk of transmission of many STDs, including HIV infection (AIDS), use a latex condom. Naturalamb brand condoms are ideal for the monogamous couple who desire heightened sensitivity with trusted pregnancy protection. Contains no latex and may be used by latex sensitive people. Water-based lubricant, for comfort and sensitivity. For pregnancy protection only - Does not protect against STDs. Each condom is individually tested to help ensure reliability. Exclusive Kling-Tite band to hold condom in place. Natural feel. No latex. Naturalamb. Naturalamb brand condoms, when used properly, are highly effective against pregnancy - although no contraceptive can guarantee 100% effectiveness. Not to be used for the prevention of Sexually Transmitted Diseases (STDs). To help reduce the risk of catching or spreading many STDs, use a latex condom. Any use of Naturalamb brand condoms for other than vaginal intercourse can increase the potential of damage to the condom. For maximum benefits, it is important to follow the instructions for use printed on the inner side of this package. Failure to do so may result in the loss of the benefits of a condom. A new condom should be applied each and every time before any intimate contact occurs. Made in USA.",http://ecx.images-amazon.com/images/I/41NOPlQ5mQL._SY300_.jpg
B000052Y6A,Clubman Moustache Wax with Brush Comb - Neutral,Magnum P.I. Rollie Fingers. Fu Man Chu. You make the call. Classic wax is perfect for styling and molding mustaches and will keep pesky hairs in place all day long. Beeswax and Coconut Oil add lasting volume and provide superior control without any greasy residue or unsettling fragrance. Comes with a mini comb/brush for application and is neutral in color.,http://ecx.images-amazon.com/images/I/116F4KKGY3L.jpg
B000052YHQ,Gillette MACH3 Shaving Cartridges (4 Cartridges),"Gillette MACH3 is a revolutionary new triple-blade shaving system for the closest shave ever in fewer strokes - with less irritation. 3 Blades specially positioned to extend gradually closer to your beard, to shave you progressively closer in a single stroke. So close there is less need to re-shave, which means less irritation. Patented DLC comfort edges-each blade has a patented DLC comfort edge, so Mach3 glides effortlessly across your face. And Mach3 has an advanced Indicator lubricating strip with a blue stripe that fades away when you are no longer getting the optimal Mach3 shaving experience.",http://ecx.images-amazon.com/images/I/21Z8TCFGJQL.jpg
B000052YD1,Colgate Peroxyl Oral Clean sr,Colgate Peroxyl Oral Clean Seniors Pack of 1,http://ecx.images-amazon.com/images/I/31QR431SG5L.jpg
B000052YBS,Tek Professional Soft Full Head Straight Toothbrush (Colors May Vary),"ADA (American Dental Association) Accepted. Curved Handle conforms to your hand for comfort and control. Tapered Head for easy access to back teeth. Easy Grip Handle/Thumb Rest for better control. End-Rounded DuPont Nylon Bristles to help protect tooth enamel and gums. Tek Pro Straight toothbrush is accepted as an effective cleansing device that has been shown to remove plaque and reduce gingivitis when used as directed in a program of good oral hygiene to supplement regular professional care. Council on Scientific Affairs, American Dental Association. Dentists and hygienists recommend replacing your toothbrush every 3 months.",http://ecx.images-amazon.com/images/I/31DK09BFKCL._SY300_.jpg
B000052YDL,"Blistex Revitalizer, .25-Ounce Tubes (Pack of 12)","Dimethicone 1% (w/w). Alpha Hydroxy formula. To soften & smooth lips. Reduces wrinkles & rehydrates. Applicator tip. Lip Revitalizer's clinically tested formula combines an alpha hydroxy exfoliant with extra moisturizers to restore your lips to a smooth, soft state. Lip Revitalizer can be used in conjunction with other lip products formulated specifically for protection from cold, wind and sun. Rehydration: Lip Revitalizer contains moisturizing ingredients plus a light moisture seal to help dry lip cells replenish. Removing Damaged Lip Cells: Lip Revitalizer's alpha hydroxy exfoliant gently removes damaged, rough cells on the surface of lips, for significantly smoother appearance and softer feel. Provides a pre-treatment base for even, consistent lipstick applications. Smoothing Appearance of Lines & Wrinkles: Clinical studies show that Lip Revitalizer significantly reduces the appearance of fine lines and wrinkles on the surface of lips within approximately one month of consistent usage.",http://ecx.images-amazon.com/images/I/512PZTHW4GL._SY300_.jpg
B000052YE4,"Mentholatum Natural Ice Lip Protectant SPF 15, Cherry Flavor, 0.16-Ounce Tubes (Pack of 12)",SPF 15. Medicated. Cooling soothing protection. Naturally. Made in the USA.,http://ecx.images-amazon.com/images/I/51fBwj1p4gL._SY300_.jpg
B000052YEW,Assess Peak Flow Meter Full Range,Full Range #710* Provides an objective measure of peak expiratory flow (PEF) * Variable indicator of lung function * Low range model is for children and patients with severly restricted expiratory flow rates *,http://ecx.images-amazon.com/images/I/11BS3X2M1AL.jpg
B000052Y5M,"Metamucil Fiber Laxative/Fiber Supplement, Coarse Milled, Unflavored, 29-Ounces  (1.8 lbs) 822 g","No. 1 Doctor recommended with 100% Natural Psyllium Fiber. 114 teaspoon doses. Unflavored. Fill controlled by weight, not volume.",http://ecx.images-amazon.com/images/I/21C606B381L.jpg
B000052Y9Y,"G-U-M Stimulator Refills, 3 Ea","G-U-M stimulator refills promote healthy and firm gums. The product is recommended by dental professionals. It stimulates and strengthens gum tissue. It has got a slender, angled neck for maximum control. They are latex free rubber tip.",http://ecx.images-amazon.com/images/I/41DQGFyvV5L._SY300_.jpg
B000052YHS,Gillette Mach3 Razor 2 Count,,http://ecx.images-amazon.com/images/I/31wDs14WBXL._SY300_.jpg
B000052YDM,"Blistex Lip Tone Lip Balm, SPF 15, .15-Ounce Tubes (Pack of 24)","Enhances natural pigment with a slight touch of color. Moisturizer-nutrient complex. Vitamins & natural extracts. A touch of color. Total care. Enhances Lips' Complexion: Lip Tone brings out the natural blush and luster of your lips with a slight touch of color. Your lips will look healthy, natural - great! Moisture Maintenance: Lip Tone's Moisturizer-Nutrient Complex combines a long lasting moisture protectant plus vitamins, amino ingredients and 4 natural plant extracts. Lip Tone helps preserve lip moisture and relieve drying. Sun Protection: PABA-free Lip Tone provides 15 times your natural protection against burning. Its SPF 15 rating is recommended even for people who burn easily and tan minimally. The liberal and regular use of this product may prevent premature signs of aging and possible cancer-causing effects of overexposure to sun. Remember, lips don't tan, but they do burn. Lip Tone complements the natural complexion of your lips by combining the effective moisturization and protection you'd expect from a Blistex lip balm with a slight touch of color.",http://ecx.images-amazon.com/images/I/51CPHSEZZYL._SY300_.jpg
B000052YE0,Gly-Oxide Liquid Antiseptic Oral Cleanser - 2 fl Ounces,"Carbamide Peroxide 10% Non USP. Recommended by physicians and dentists. For minor mouth or gum irritations. Cleanses dental appliance irritations. Soothes canker sores. Kills odor-forming germs. Oxygen-rich microfoam action. Note: Oversize package for ease in reading label information. Contains one bottle, the actual size of which is shown.",http://ecx.images-amazon.com/images/I/11GET9JBJEL.jpg
B000052XUV,"BFI Antiseptic First Aid Powder, 1.25 oz",B.F.I. POWD LGE Size: 1.25 OZ,http://ecx.images-amazon.com/images/I/115P9KCETML.jpg
B000052YCL,"Biotene Mouthwash, 16 Fl Oz","Improved!AntibacterialAlcohol-FreeThe Gentle Mouthwash That Kills GermsClinically, Allergy and Hospital TestedImagine a mouthwash with a soft, gentle feel containing a strong antibacterial formula. A mouthwash that, instead of irritating tender tissues, positively contributes to their health.That mouthwash isBiotene.OnlyBiotenecontains 4 antibacterial enzymes which boost the defense system normally found in your saliva. Together, they help protect your teeth and gums.Biotene is especially beneficial to individuals experiencing dry mouth or having oral irritations.",http://ecx.images-amazon.com/images/I/41mtsp07urL._SY300_.jpg
B000052YCE,Rigident Adhesive Denture Adhesive Powder - 3 oz,"Holds strong for extra confidence. ADA Accepted - American Dental Association. Rigident is scientifically formulated to help keep your dentures tight and comfortable. Clinical tests prove Rigident strengthens and increases denture hold. Rigident Powder is Accepted as a temporary measure and may provide increased retention of complete dentures. However, ill-fitting dentures may impair your health - consult your dentist as soon as possible. Council on Scientific Affairs. American Dental Association. Made in Italy.",http://ecx.images-amazon.com/images/I/41K3CJFSMKL._SY300_.jpg
B000052YI0,Flicker Classic Women's Shaver Blades By Personna - 5 ea,"FLICKER  The Women's Shaver designed for safety to protect your skin from nicks and cuts.  Flicker's stainless steel ""SKINSHIELD blade with wire wrapping provides a protective guard so the blade glides gently over your skin.  It is designed to let you cut hair and not skin.A complete shaving system containing 5 bladesA self-contained design without separate blades or razors to handle.Shape is easy to grip even with wet hands.Designed to shave legs and underarms.Blades are numbered so you'll know when to pick up your next Flicker.",http://ecx.images-amazon.com/images/I/118DX6KX4AL.jpg
B000052Y9S,GUM Go Between Proxabrush Tight Refills-8ct,"#1 Interdental brandRemoves plaque between teeth as effectively as string floss**Only interdental brand with antibacterial bristle protection*Nylon coated wire protects dental restorations* Bristles have a patented Chlorhexidine antibacterial coating for continuous bristle protection during the recommended life of the brush. Bacterial growth that may affect the bristles is inhibited. The Chlorhexidine in the bristles does not protect you against disease.** Yost KG, et al. Interproximal Gingivitis and Plaque reduction by Four Interdental products. J Clin Dent. 2006; 17(3):79-83.G18:G20Made in USA",http://ecx.images-amazon.com/images/I/41mEZ0%2BRdyL._SY300_.jpg
B000052Y86,"Colgate Total Toothpaste, Clean Mint Paste , 6-Ounce Tube",,http://ecx.images-amazon.com/images/I/41oUskygMzL._SX300_.jpg
B000052XS4,"Ace Neoprene Ankle Brace, One Size (1 Brace)",This product is not eligible for priority shipping. Image may vary from the actual product.,http://ecx.images-amazon.com/images/I/51NGF-R1NyL._SY300_.jpg
B000052YDD,"Binaca Concentrated Peppermint Breath Spray, .2 oz",&lt;P&gt;A Binaca &lt;B&gt;BLAST &lt;/B&gt;Freshens Breath Instantly!&lt;UL&gt;&lt;LI&gt;&lt;B&gt;Great tasting flavor leaves your mouth feeling cool and refreshed&lt;/B&gt;&lt;/LI&gt;&lt;LI&gt;&lt;B&gt;Long Lasting&lt;/B&gt;&lt;/LI&gt;&lt;LI&gt;&lt;B&gt;Sugar Free&lt;/B&gt;&lt;/LI&gt;&lt;LI&gt;&lt;B&gt;Approximately 150 measured sprays&lt;/B&gt;&lt;/LI&gt;&lt;LI&gt;&lt;B&gt;Convenient size for pocket or purse&lt;/B&gt;&lt;/LI&gt;&lt;/UL&gt;&lt;/P&gt;,http://ecx.images-amazon.com/images/I/41TeDiQYFrL.jpg
B000052YDK,"Blistex Lip Medex, .38-Ounce (Pack of 12)","Relieves sore lips and restores moisture balance. Quickly cools, comforts, and relieves. Blistex Lip Medex is formulated to provide quick cooling lip relief you can feel working. Lip Medex also helps to restore a healthy moisture balance to lips. Sore Lips: Lip Medex medicated ingredients deliver a noticeable and immediate cooling action to provide fast relief from the hot, itching sensations that accompany sore lips. Serious Dryness: Lip Medex provides a special barrier that helps lip cells return to their natural moisture balance. As with all products, a few individuals may be sensitive or allergic to this formula. This is a personal care item, and should be used by one individual only.",http://ecx.images-amazon.com/images/I/51HEoA-tLfL._SY300_.jpg
B000052YE9,Orajel Maximum Strength Gel Oral Pain Reliever - .42 oz,"&lt;P&gt;25% More Free than 0.33oz size.&lt;BR&gt;&lt;B&gt;Oral Pain Reliever For Toothache&lt;BR&gt;&lt;/B&gt;Provides Immediate Toothache Pain Relief. Starts working up to 30 minutes faster than aspirin, acetaminophen or other pain relief pills.&lt;/P&gt;",http://ecx.images-amazon.com/images/I/51-KuG8sccL._SX300_.jpg
B000052YAC,Crest Glide Dental Floss,Dentist recommended brand. Shred resistant. Effectively removes plaque. Experience the Glide difference. Silky smooth texture slides easily between teeth. Effectively removes tough plaque between teeth and just below the gum line. Gently stimulates gums.,http://ecx.images-amazon.com/images/I/214W00VFG0L.jpg
B000052YFJ,Emetrol For Nausea &amp; Upset Stomach Cherry,Safe for children. No salicylates. No antihistamines. No alcohol. No caffeine. Recommended by doctors and pharmacists. Clinically proven relief for nausea due to upset stomach. Safe for children with flu or fever. Doctor recommended.,http://ecx.images-amazon.com/images/I/415QBBYXC7L._SY300_.jpg
B000052YHV,"Gillette SensorExcel Cartridges, 5-Count","Comfort Blades. Soft, protective microfins. The closest, most comfortable twin blade shave. SensorExcel has a series of soft, flexible microfins positioned in front of the blades to protect your skin while gently setting up your beard so the blades can sh",http://ecx.images-amazon.com/images/I/31BFSseOEWL.jpg
B000052YC6,Fixodent Extra Hold Denture Adhesive Powder-2.7 oz,"Fixodent Extra Hold guarantees a strong, thin airtight seal so you can laugh, talk, eat and drink with confidence.",http://ecx.images-amazon.com/images/I/110BBKRH2QL.jpg
B000052YDE,"Binaca sugar-free Aeroblast 150 Breath Spray, Spearmint 0.2 oz",&lt;P&gt;&lt;UL&gt;&lt;LI&gt; Long Lasting &lt;/LI&gt;&lt;LI&gt; Sugar Free&lt;/LI&gt;&lt;LI&gt; Great tasting flavor leaves your mouth feeling cool and refreshed.&lt;/LI&gt;&lt;LI&gt; Approximately 150 measured sprays.&lt;/LI&gt;&lt;LI&gt; Convenient size for pocket or purse.&lt;/LI&gt;&lt;/UL&gt;&lt;/P&gt;,http://ecx.images-amazon.com/images/I/417vsRfjlxL._SY300_.jpg
B000052YCV,"Listerine Antiseptic Mouthwash, Cool Mint - 1 L","Kills germs that cause bad breath, plaque &amp; the gum disease Gingivitis",http://ecx.images-amazon.com/images/I/21BKZH4D2RL.jpg
B000052YCW,"Listerine Antiseptic Mouthwash, Cool Mint - 250 ml","Kills germs that cause bad breath, plaque & the gum disease Gingivitis. ADA Accepted (American Dental Association). Cool Mint Listerine Antiseptic has been shown to help prevent and reduce supragingival plaque accumulation and gingivitis when used in a conscientiously applied program of oral hygiene and regular professional care. Its effect on peritonitis has not been determined. (Council on Scientific Affairs, American Dental Association.)",http://ecx.images-amazon.com/images/I/41jBtO167CL._SY300_.jpg
B000052YIY,Vicks Vaposteam 8 Oz,"Vicks VapoSteam, when added to your Vicks Vaporizer or other hot or warm steam vaporizer, increases the action of steam to moisten dry, irritated breathing passages and temporarily relieve coughs due to minor throat and bronchial irritation associated with a cold.",http://ecx.images-amazon.com/images/I/41%2BJ-TTfYhL._SY300_.jpg
B000052YEA,Orajel Oral Pain Reliever - Day/Night - 0.18 oz - 2 ct,"#1 Teething Brand Recommended by Pediatricians Instant Relief for Teething Pain 1 Daytime Nighttime Twin Pack 3 Extra Strength for Nighttime 5 Longer Lasting 4 2 Cherry Flavored Gels Ingredients: br Daytime: Active Ingredients: Benzocaine . Inactive Ingredients: Cellulose Gum, Flavor, Gelatin, Mineral Oil, Pectin, Petrolatum, Polyethylene Glycol, Red 40, Sodium Saccharin. Nighttime: Active Ingredients: Benzocaine . Inactive Ingredients: Cellulose Gum, Flavor, Gelatin, Mineral Oil, Pectin, Petrolatum, Polyethylene Glycol, Red 40, Sodium Saccharin. 2 - 0.18 oz Tubes ~ Net Wt 0.36 oz",http://ecx.images-amazon.com/images/I/515XXWn97BL._SX300_.jpg
