asin,title,description,imUrl
B000050FDE,Oral-B Professional Care 1000 Power Toothbrush,"The Oral-B ProfessionalCare 1000 (formerly ProfessionalCare 7400) provides dentist-inspired cupping action in which a unique, round brush head surrounds each tooth for a tooth-by-tooth clean.  The combination of high-speed pulsations and the oscillating rotating technology has been shown to reduce plaque and gingivitis more effectively than a regular manual toothbrush.IntroductionWith dentist-inspired cupping action for tooth-by-tooth clean.ProfessionalCare 1000/7400 provides dentist-inspired cupping action in which a unique, round brush head surrounds each tooth for a tooth-by-tooth clean.Removes up to 97% of plaque from hard-to-reach areas*Helps prevent and reverse gingivitisPressure sensor stops pulsations when you&#8217;re brushing too hard1 mode: Daily CleanOral-B is the #1 dentist-recommended toothbrush brand worldwide* Based on single-use brushing studyProduct FeaturesFEATURESCleaning action:Provides 40,000 pulsations and 8,800 oscillations per minuteProfessional timer:A two-minute timer with 30-second intervals makes it easy to track how long you&#8217;ve been brushingPressure sensor:Stops pulsations to notify you when you&#8217;re brushing too hard1 customized brushing mode:Daily CleanIndicator&#174; bristles:Remind you to replace your brush head every 3 months, once they&#8217;ve faded halfwayMultiple attachment brush heads with compact, round designPrecision Clean Brush Head:Provides a deep and thorough cleanDual Clean Brush Head:Provides cleaning, freshening and gum careCharge indicator:Lets you know that the brush is chargedDETAILS2-Year Limited Warranty and Satisfaction Guarantee:If you are not 100% satisfied within 60 days of purchase, return it for a full refund. Warranty includes replacement or repair. Consumer must ship product, postage paid, and include a copy of proof of purchase. See inside of product package for full details.Parts:Handle colors: Blue/whiteBrush head types: Oral-B Precision Clean, Oral-B Dual Clean, Oral-B Pro White, Oral-B Sensitive, Oral-B Power Tip, Oral-B Ortho, Oral-B Braces Care Essentials, Oral-B Tongue FreshenerSeries: ProfessionalCareModel: 1000/7400Power source: Rechargeable batteryBattery life: Up to 2 weeks without rechargingIn The BoxIncludes:*1 handle2 brush heads (Oral-B Precision Clean, Oral-B Dual Clean1 charging station*Contents may not be available in all models.",http://ecx.images-amazon.com/images/I/31AmKTPWMkL._SY300_.jpg
B000050FFK,HoMedics FPA-2H Deluxe Personal Foot Massager with Heat,"After exercise, work, shopping, or just a long day, nothing beats a  soothing foot massage. This portable electric foot massager is on call 24/7 to  relieve aching feet. Just sit down, take off your shoes, and run your feet over  the two domed 2-1/2-inch vibrating heads. Push the ""heat"" button on the  LED-illuminated, touchpad control panel with a big toe and the heads will warm  up, too. The control panel offers numerous options: steady massage at five  intensity levels or three different rhythms (""slow"" to relax, ""faster"" to  penetrate deeply, and ""quick"" to stimulate). The massager measures 14 by 12  inches, is angled for comfort, and carries a two-year warranty against defects.--Fred Brack",http://ecx.images-amazon.com/images/I/41SVNW48K2L._SX300_.jpg
B000050FDX,"Braun 7000 Series Syncro Pro / Syncro Replacement Combo, Fits Braun Series 3","A replacement foil and cutter block, the two pieces fit Braun Syncro  shaver models 7505, 7526, 7546, and 7570. These shavers need a new foil and  cutter block every 12 to 18 months, depending on toughness of beard and  frequency of use. Braun Syncro shavers are noted for their four-way moving head  that captures and cuts more hair in fewer strokes. The pivoting head oscillates  from side to side, and large foil holes capture more hairs.--Fred Brack",http://ecx.images-amazon.com/images/I/31wr0i5EYyL.jpg
B000050FE0,Thermoscan Exactemp Ear,"Get quick and accurate results with this Braun Thermoscan one-second ear thermometer. The thermometer beeps and confirms the end of the temperature measurement, displaying results within one second. Features extended memory for last temperature taken and an easy-to-read LCD display screen. Includes 21 lens filters and a protective case. Imported. 6-1/4L""",http://ecx.images-amazon.com/images/I/2175X2HQ2FL._SY300_.jpg
B000050FFQ,HOMEDICS BODY MASSEUR 10 PT.MA,"This full-length massage pad offers a variety of features, all controlled from a simple unit attached by a short cord on the right side. The control unit has one button for each of the five pairs of motors and five other controls for speed, heat, massage style, and other features. Choose from three speeds and power levels and from steady, up-and-down, side to side, pulsating, and circulating massage. Works best flat or nearly flat. Made from soft foam, with a zippered cover.--Richard Farr",http://ecx.images-amazon.com/images/I/31HAEYMMGNL._SY300_.jpg
B000050FFJ,HoMedics PA-2H Programmable Percussion Action Massage with Heat,"This is the stuff of dreams--your own personal massage assistant, on call 24/7 to relax sore, tired muscles or warm up slumbering ones. But it's no dream. This electric massager has all those virtues plus the capacity to provide steady massage at five intensity levels or work at three different rhythms (slow to relax, faster to penetrate deeply, and quick to stimulate). It can be set for hard, medium, or soft massage, and it massages with heat. All these options are available through an LED-illuminated, touch pad control panel and by changing the attachments on the dual pivoting heads that direct wave action deep into muscles. The attachments are domes of 1-3/4 inches in diameter that come in different colors (for hard, medium, soft, heat) and twist on and off. The massager is 14-3/4 inches long to reach your entire back, the head is 6 inches wide, and the power cord measures 12 feet. The massager carries a two-year warranty against defects.--Fred Brack",http://ecx.images-amazon.com/images/I/31QZQ20CBNL._SX300_.jpg
B000050FFZ,HoMedics HD-200 PowerDent Rotary Toothbrush,"By rotating through a 75-degree arc at a rapid rate (3,600 strokes per  minute), a round brush head snapped onto this electric toothbrush's power handle  scrubs away decay-causing plaque from between teeth and along gum lines better  than ordinary toothbrushes. To encourage kids to brush more frequently, the  inexpensive toothbrush, its recharging base, and the three color-coded brush  heads are cloaked in translucent blue plastic for a cool high-tech look. The  recharging base provides four storage slots for brush heads not in use and can  be mounted with screw and screw plugs (included) on a counter. The toothbrush  comes with a two-year warranty against defects.Replacement brush headsare  available.--Fred Brack",http://ecx.images-amazon.com/images/I/316RSHNSCXL._SY300_.jpg
B000050FF4,BODY BASICS SOUND AND AROMA THERAPY ENVIR SP,"Just add some steamed towels to this aroma and sound machine and you have a complete home spa. The machine, which resembles a small flying saucer, combines the ancient art of aromatherapy with modern sound technology for a rich sensory experience. You can customize your spa environment by choosing from four all-natural scents and six soothing sounds: ocean waves, a summer night, a brook, spring rain, woodland sounds, or white noise. Try experimenting with sound and scent combinations: the ""relaxation"" aroma beads, a blend of lavender, chamomile, and sage, work well with the sound of ocean waves if you want to drift off to sleep, for example. You can also use your own essential oils to further broaden your relaxation options. There's an aromatherapy-only option if you'd rather listen to your own music, as well as a sound-only option. The machine is powered by an AC adapter or four AA batteries (not included) and is small enough to slip into a suitcase.--Laura Cuthbert",http://ecx.images-amazon.com/images/I/410BJ800PRL._SX300_.jpg
B000050FDU,Braun 4000FC-BK Flex Control Foil/Cutterblock Replacement Pack,"Have you noticed a decline in your electric shaver's performance? Try replacing the blade. For optimum shaving performance, it should be replaced every 18 months. In fact, regular shavers estimate their shaves are 25 percent smoother after they replace a worn blade. This replacement blade snaps in easily for an instant improvement in your shave. For an even better shave, clean all parts regularly.--Laura Cuthbert",http://ecx.images-amazon.com/images/I/41BGBQM4Z8L._SX300_.jpg
B000050FDT,Braun 3000 Series InterFace/Interface Excel Replacement Pack,"Braun recommends that the heads on its InterFace electric razors (model numbers in the 3615, 3612, and 3610 series) be replaced every 18 months. This pack consists of the foil and cutterblock for those InterFace razors. The foil is thin platinum and the cutterblock is stainless steel. The foil is spring-mounted for a close, comfortable shave. Installation is easy, and diagrams on the package show how to do it.--Fred Brack",http://ecx.images-amazon.com/images/I/415EX1NF53L._SX300_.jpg
B000050FE6,Braun EE1170 Silk-Epil SuperSoft Plus Leg Hair Removal System,"This electric device quickly and precisely removes hair from legs and arms while two stimulator wheels roll over the skin to mask the epilation feeling. By tweezing hairs at the roots, the device offers smooth, hairless skin for up to three weeks after treatment. As hairs grow back, they become finer, making them less noticeable and easier to remove. The device even removes extremely short hairs no more than .5 millimeter in length and offers two tweezer-grip settings--to distinguish between normal and fine hair--and three speeds. A cleaning brush, a tube of skin moisturizer, and a storage pouch are also included.--Fred Brack",http://ecx.images-amazon.com/images/I/410VER3783L._SY300_.jpg
B000050FDZ,Braun EP100 Exact Power Beard Trimmer,"With a six-setting memory switch, this 5-watt trimmer ensures consistent beard and mustache lengths from trim to trim. It provides two speeds for careful trimming and the extra power needed to handle heavy-growth areas. With the distancing comb removed, the head pivots so that a narrow trimmer replaces the regular cutting head and permits precise outlining of beard, mustache, and sideburns. The memory switch can be set to trim hair to lengths of approximately 1, 3, 6, 9, 12, and 16 millimeters. Once the memory switch is set, it prevents the trimmer from turning on until you choose the proper length. The trimmer functions either with or without its cord. It fully charges in one hour for 30 minutes of cordless operation, works worldwide on 110- to 240-volt systems, and comes in a soft travel case. It carries a 30-day, full-refund guarantee and a two-year warranty against defects.--Fred Brack",http://ecx.images-amazon.com/images/I/416C80TPK4L._SY300_.jpg
B000050FF0,HoMedics AK-3 Foot Pro Ultra Luxury Foot Massager,"Sit down. Take off your shoes. Use a big toe to turn on this electric foot massager. (There's a toe-friendly on/off switch at the bottom.) Use that toe to select the intensity of the foot massage you desire (high or low). Cold feet? Direct the toe to the infrared switch for muscle-relaxing, penetrating heat. Now lean back and run your tired, aching feet over the massager's vibrating surface while different-size bumps rejuvenate you according to the ancient practice of reflexology (or, if you don't accept reflexology's tenets, soothingly stimulate your feet). This durable plastic device measures 14 by 12 inches and is angled so your feet rest comfortably while you're seated. The massager carries a two-year warranty against defects.--Fred Brack",http://ecx.images-amazon.com/images/I/515MW71YYAL._SX300_.jpg
B000050FDB,Oral-B D9511 Plak Control Ultra Power Toothbrush with Timer and Charger,"Small and round for maneuverability inside the mouth, the brush head on this electric toothbrush rapidly oscillates to scrub away plaque from between teeth and along gum lines, giving your teeth a better cleaning than ordinary toothbrushes. Two sets of extra-long bristles on the brush head's sides clean deep between teeth, and soft, rounded middle bristles do their work gently and safely without the need for firm pressing. After two minutes, a pulsing signal indicates that you've reached the recommended brushing time, an incentive for children to continue brushing until the signal. This model comes with a recharging stand that you can place on the counter or mount on a wall (mounting screws are included) and one brush head with a removable color-coded ring. After up to three weeks of use, Braun offers a full-refund guarantee if you're not satisfied with your purchase. The handle carries a one-year warranty against defects.--Fred Brack",http://ecx.images-amazon.com/images/I/31TEDPR616L._SY300_.jpg
B000050FDL,Braun 3612 InterFace Rechargeable Shaver,"Lightweight and shaped to fit the hand comfortably,  this electric razor delivers a smooth shave either with or  without a cord. A floating cutter trims long hairs, and then  a thin platinum foil follows along to shave close to the  skin. Push a button and the cutter retracts for shaving with  the foil alone. Push the button again, and up pops a trimmer  for mustache and sideburns. The shaver works worldwide on  110- to 240-volt systems and can be recharged by a 12-volt  car or boat battery. It recharges fully in one hour for 30  minutes of shaving time. A green light signals when charging  is underway. The shaver carries a two-year warranty against  defects (foil and cutter block excluded).--Fred  Brack",http://ecx.images-amazon.com/images/I/41ETN94F6RL._SX300_.jpg
B000050FEZ,Homedics Luxury Foot Bubbler,"Filled with warm water, this electric footbath presents a pleasing dilemma: massage your feet with the bath's warm, vibrating bottom and warm them with penetrating infrared heat? Massage, warm with infrared heat,andstimulate with bubbles? Or just treat those tired, aching tootsies to a warm, bubbling bath? (Warm water must be used initially, as the bath will not heat cold water.) A control dial offers those three options. Plus, you can insert one or another of three attachments in the bath's divider and run your feet over them for further relief. One attachment has a few large nodules, another has many small nodules, and the third is a roller. The infrared pad is situated on the divider. Made of translucent plastic for the high-tech look, the foot bath measures 18 by 15-1/2 by 7 inches and is about 3 inches deep. It carries a two-year warranty against defects.--Fred Brack",http://ecx.images-amazon.com/images/I/51ZBF6GR00L._SY300_.jpg
B000050FFL,Homedics Back Massager with Heat,"With this device, there's no reason why sitting at home or the office or idling in rush-hour traffic can't be soothing and relaxing. It's a body-sculpted, padded, soft fabric body massager that fits most chairs and car seats, secures with elastic straps, and then massages shoulders, back, and thighs at five separate points with five little motors. It also produces heat for the lower back. An LED-illuminated remote control allows you to choose from three massage intensities, select for heat, and choose which body parts to massage. An AC home adapter and a 12-volt auto adapter come with the massager, which carries a two-year warranty against defects.--Fred Brack",http://ecx.images-amazon.com/images/I/41RQZYNMKZL._SY300_.jpg
B000050HDT,Dirt Devil Replacement Sponge for Mop Vac,"This 10-inch slide-on replacement sponge, with metal back, fits Dirt Devil mop vac models. It comes in a nice two-tone gray color. (Does this matter? Yes--it looks much better dirty than white or cream-colored sponges.)--Richard Farr",http://ecx.images-amazon.com/images/I/413N60X144L._SX300_.jpg
B000050XV0,Cold Blue,,http://ecx.images-amazon.com/images/I/51iWJOaADoL._SX300_.jpg
B000051SE7,,"Energizer e2 &#x97; Only one battery delivers this kind of performance and convenience. Only one battery brings advanced technology, precise engineering and innovative design together in one product. Energizer e2 is:Designed with a heart of titanium and advanced cell construction that takes power to the next level.Packaged in an easy open, easy close container for convenient use and storageEquipped with a gauge-style tester for an accurate read on remaining powerEngineered to mazimize performance in all your power-hungry devicesEnergizer e2 takes power to the next level&#x97;power you can enjoy when you listen to music, take pictures, play with toys, talk on the phone, light the path and simply enjoy the pleasures of an unplugged world.",http://ecx.images-amazon.com/images/I/51C5SX7S48L._SX300_.jpg
B000051SE8,"AA Battery, Energizer e2 Titanium Technology, Performance Alkaline Battery, 4/Pk EVEX91RP4","Energizer's Most Powerful Alkaline Battery. Energizer e2 Titanium Technology is ideal for use in high-powered devices such as MP3 players, portable CD players, wireless gaming devices and other digital devices.",http://ecx.images-amazon.com/images/I/51R4QMASQ4L._SY300_.jpg
B000051SE5,Energizer e2 AAA 8-Pack,"Energizer e2 &#x97; Only one battery delivers this kind of performance and convenience. Only one battery brings advanced technology, precise engineering and innovative design together in one product. Energizer e2 is:Designed with a heart of titanium and advanced cell construction that takes power to the next level.Packaged in an easy open, easy close container for convenient use and storageEquipped with a gauge-style tester for an accurate read on remaining powerEngineered to mazimize performance in all your power-hungry devicesEnergizer e2 takes power to the next level&#x97;power you can enjoy when you listen to music, take pictures, play with toys, talk on the phone, light the path and simply enjoy the pleasures of an unplugged world.",http://ecx.images-amazon.com/images/I/51V1YA68C1L._SY300_.jpg
B000051SEQ,"Suunto Advizor Wrist-Top Computer Watch with Barometer, Compass, Altimeter, and Chronograph","Take your training to the next level with the Suunto Advizor. This wrist  computer receives a signal from the included heart-rate transmitter to measure  your total training time, maximum, minimum and average heart rate during  training, plus your time spent in, above, and below your preset target heart  rate. The Advizor also features an altimeter, barometer, and compass in its  stylish and rugged design.The Advizor looks like a high-end wristwatch, with an ABS plastic body and  elastic wristband. The body is gray, with an oversized backlit LCD screen. It is  made tough, built to be waterproof even submerged at 100 feet. The watch  displays day, time, and date with three programmable alarms and has a stopwatch  and countdown timer.The Advizor's altimeter allows you to view the current altitude with a range up  to 29,500 feet and a resolution of 10 feet. Also view your ascent/descent rate  in feet per minute. (All measurements are also available in metric units.) The  barometer allows you to measure the temperature in Celsius or Fahrenheit,  absolute pressure, and a difference measurement to follow changes in barometric  pressure and temperature. The automatic four-day memory keeps track of  atmospheric pressure information. Another feature is the adjustable sea-level  pressure function.The compass shows directional bearing in degrees and cardinal or half-cardinal  point. There is a north-douth arrow and a bearing tracking function that  displays locked bearing, actual bearing, and the difference between these  declination adjustments. The compass's bubble level indicates a level position  to ensure reading accuracy within 2 to 3 degrees.The Advizor comes with a user-replaceable battery, which lasts up to 18 months,  and a low-battery indicator. It is covered by a one-year warranty.",http://ecx.images-amazon.com/images/I/51HZH27DDYL._SY300_.jpg
B000051SE9,Energizer-Eveready 02708 X22RP-2 E2 9V-2PK,"Energizer e2 &#x97; Only one battery delivers this kind of performance and convenience. Only one battery brings advanced technology, precise engineering and innovative design together in one product. Energizer e2 is:Designed with a heart of titanium and advanced cell construction that takes power to the next level.Packaged in an easy open, easy close container for convenient use and storageEquipped with a gauge-style tester for an accurate read on remaining powerEngineered to mazimize performance in all your power-hungry devicesEnergizer e2 takes power to the next level&#x97;power you can enjoy when you listen to music, take pictures, play with toys, talk on the phone, light the path and simply enjoy the pleasures of an unplugged world.",http://ecx.images-amazon.com/images/I/51EHF2JDG8L._SY300_.jpg
B000051VZM,Popular Party Tunes,Performances not by original artists,http://ecx.images-amazon.com/images/I/61f79ZRGe0L._SL500_SX300_.jpg
B0000521Q5,Tecno Fes 2,,http://ecx.images-amazon.com/images/I/51QGpG2uWfL._SY300_.jpg
B00005247P,Enjoy,,http://ecx.images-amazon.com/images/I/51m2e2YnMtL._SY300_.jpg
B0000524RA,SportBrain Heart Rate Strap,,http://ecx.images-amazon.com/images/I/31A210GE5XL._SX300_.jpg
B000052WNR,"Bayer Aspirin Pain Reliever Tablets,, 100-Count Bottle","Pain Reliever/Fever Reducer. Fast, safe pain relief Plus the life saving benefits of aspirin. Headaches; Everyday aches and pains. Doctor recommended for Aspirin Regimen Use. Aspirin is not appropriate for everyone, so be sure to talk to your doctor before you begin an aspirin regimen. Package not child resistant.",http://ecx.images-amazon.com/images/I/51wniFmmTsL._SX300_.jpg
B000052WQ1,"Tylenol Pain Reliever/Sleep Aid, Extra Strength Geltabs, 100-Count","Acetaminophen, Diphenhydramine HCI. Non-habit forming.",http://ecx.images-amazon.com/images/I/51DA1MY84NL._SY300_.jpg
B000052WNZ,Bayer Aspirin Regimen Pain Reliever Enteric Coated Caplets - 325Mg,"Enteric is a fancy word that nobody, but nobody uses in real conversation. Consider it a code word for ""won't hurt your stomach."" The Bayer Regimen aspirin series is for people who take daily aspirin for medical reasons. This version is coated to protect you from the stomach upset that sometimes accompanies aspirin use. Caplets are also especially easy to swallow, so this is one aspirin that's particularly easy to take.Enteric Safety Coated Caplets - Delayed Release Aspirin 325mg.Aspirin Regimen Bayer&reg;Doctor recommended for regular use.Specifically designed for people on a regimen of aspirin, or as directed by your doctor.Safety coated to help protect your stomach.PureBAYER&reg;Aspirin inside.Caffeine free and very low sodium.Easy-to-swallow caplet shape.&nbsp;The Wonder Drug That Works Wonders&reg;Safety coated, to help protect against stomach upset.&nbsp; The enteric coating onAspirin Regimen Bayer&reg;allows the caplet to pass through the stomach to the intestine before it dissolves, helping to protect against stomach upset.",http://ecx.images-amazon.com/images/I/212T5N7WXKL.jpg
B000052WTZ,Titralac Extra Strength Antacid Tablets - 100 ea,"Extra Strength Antacid for Instant ReliefMint-flavored, Non chalkyCalcium RichAluminum FreeSugar FreeVery Low Sodium",http://ecx.images-amazon.com/images/I/11XYJVB8A7L.jpg
B000052WN2,"Aleve Caplets, 150-Count Bottle","It's hard to believe that Aleve only arrived on the scene as recently as 1994. One reason it already seems like an old favorite is that it was tried and true before it became a household name. The effective and fast-acting pain reliever and fever reducer is based on Anaprox, the active ingredient in a top-selling prescription arthritis medicine. Caplets make this medicine especially easy to swallow.All Day StrongNaproxen Sodium 220mg -Pain reliever/fever reducer.150&nbsp;Caplets ~Capsule Shaped Tablets.Each Caplet contains: Sodium 20mg.",http://ecx.images-amazon.com/images/I/51VvYuejfmL._SX300_.jpg
B000052WTG,"Pepcid AC Acid Reducer, Original Strength Tablets, 30-Count",Famotidine Tablets 10 mg. Just one tablet! Prevents & relieves heartburn due to acid indigestion. Pepcid AC prevents heartburn due to acid indigestion brought on by eating and drinking certain foods and beverages.,http://ecx.images-amazon.com/images/I/51nSAPEwiCL._SX300_.jpg
B000052WQH,"Vanquish Caplets, Analgesic Pain Reliever (100 caplets)",Extra-strength pain formula with two buffersSpecially shaped for easy swallowing.,http://ecx.images-amazon.com/images/I/21X1XBAM3EL.jpg
B000052WOY,"Midol Complete Caplets, 24 Count","Midol Complete contains a unique combination of a maximum strength pain reliever, a diuretic to help relieve bloating and caffeine to help fight fatigue.",http://ecx.images-amazon.com/images/I/51gup0kN8lL._SX300_.jpg
B000052WVB,AMMENS POWD SHOWER FRESH Size: 11 OZ,AMMENS POWD SHOWER FRESH Size: 11 OZ,http://ecx.images-amazon.com/images/I/11D6DBJQSFL.jpg
B000052WNT,"Bayer Aspirin Pain Reliever/ Fever Reducer, 300-Count Coated Tablets","Pain Reliever/Fever Reducer. Fast, safe pain relief Plus the life saving benefits of aspirin. Headaches; Everyday aches and pains. Doctor recommended for Aspirin Regimen Use. Aspirin is not appropriate for everyone, so be sure to talk to your doctor before you begin an aspirin regimen.",http://ecx.images-amazon.com/images/I/51KRR6XCBHL._SY300_.jpg
B000052WYR,Nair Hair Remover 4 Minute Lotion with Aloe &amp; Lanolin,Helps Reduce Appearance Of Hair Growth.Nair&reg; Lotion with Aloe &amp; Lanolin leaves legs totally touchable!4 Minute Lotion.Dermatologist and Salon tested.,http://ecx.images-amazon.com/images/I/21X7YE3G2ML.jpg
B000052WV3,"Pepto-Bismol Liquid, Maximum Strength, Upset stomach Liquid - 12 Oz",Bismuth Subsalicylate. Soothing Relief for 5 Symptoms: Heartburn; Indigestion; Upset Stomach; Nausea; Diarrhea. Salicylate 236 mg; Low Sodium; Sugar Free. Each Tbsp Contains: Sodium 6 mg.,http://ecx.images-amazon.com/images/I/416E27VSNFL._SY300_.jpg
