asin,title,description,imUrl
9533223510,"Agustin Reyes Products Agua de violetas Original,''Eau de Cologne''","Enjoy the clean, mild and long lasting fragrance of Royal Violets Eau de Cologne. So clean and fresh, it has been used as baby cologne for more than 75 years. So long lasting and sophisticated it'll be your favorite fragrance long after you're all grown up!. A true cultural icon.",http://ecx.images-amazon.com/images/I/41lkZsbnnEL._SY300_.jpg
9533222468,Healing Hematite Necklace with Head Skull,"Hematite powers that can be used for Eastern Medicine treatment of everything from pain, stress, depression, therapy and feeling in the Mind, Spirit and Body",http://ecx.images-amazon.com/images/I/413a5HgcpUL._SX300_.jpg
9543000042,Iris Deep Rose Lelo Personal Massager,"IRIS is a playful pleasure object with easygoing ambiance and a passionate vibe. The purposefully sculpted medical-grade silicone stem, inspired by a budding flower, makes for easy access to all those special places. Five pre programmed pleasure modes and two individually balanced vibrator engines ensure a wide array of deep and sensual rubdowns. The intuitive interface dial facilitates precise massage control in the steamiest situation, making IRIS a handy companion for any manner of erotically laden fun and games. IRIS is rechargeable and a 3 hour charge will provide up to 4 hours of bliss. The best quality at the best price. Don't cut corners when it comes to your massager. When only the very best will do, buy LELO. Your IRIS DEEP ROSE includes: One IRIS DEEP ROSE massager, Gift box/Safe keeping box, Universal Charger (110v North America, 220v Europe/Asia etc), User Information manual (read it to discover its other qualities), Satin carry pouch, 1 year LELO warranty, 7 day DOA warranty from ADULTFUNSHOP.",http://ecx.images-amazon.com/images/I/31hPgNW%2BniL._SY300_.jpg
9540000009,McKesson StayDry Underwear - Large (44&quot;-58&quot; Waist) Case/72,"McKesson StayDry Protective Underwear Pull Ups are excellent incontinence products for protecting against light to moderate urinary incontinence. And the best part is, they move up and down just like real underwear! Get the protection you need with the comfort you deserve with McKesson StayDry Protective Underwear!",http://ecx.images-amazon.com/images/I/21E44NWTW7L.jpg
9533222581,Blessed By Pope Benedit XVI Sacred Heart Pendant Scapular,Here's a modern way to wear traditional images. Front and back images of the Sacred Heart and Immaculate Heart of Mary on a durable cord. Suitable for all ages,http://ecx.images-amazon.com/images/I/61ldsneRGoL._SX300_.jpg
9543000050,Lelo Iris Pink,"Height: 4.750Length: 10.500Diameter: 2.500The LELO edge manifests itself most clearly in five aspects: aesthetics, ergonomics, function, quality and packaging. The 9"" x 1.25"" pink LELO IRIS is a playful pleasure object, graceful in appearance, yet powerful and skilful in pleasuring performance. Five pre-programmed stimulation modes and a pair of individually balanced vibrator engines, operating in harmony, provide the basis for deep and sensual experiences. The intuitive interface dial, responsive to the slightest whim, facilitates exact intensity control, while the ergonomically curved stem stays intimately in touch with all those special places. IRIS is rechargeable and a 3-hour charge provides up to 5 hours of bliss. Comes presented in an elegant gift box, accessorised with charger, manual, satin pouch for stylish storage and a 1-year LELO warranty.",http://ecx.images-amazon.com/images/I/314Kc0C9KjL._SY300_.jpg
955900008X,"Lelo Nea Vibrator, Deep Rose","Nea is the modest sister of LILY, is a slight and ornate pleasure object with a porcelain-like finish and deceptively powerful purr. Decorating the glossy exterior, pleasing to the eye as well as to the touch, are delicate floral motifs reminiscent of the belle epoque. Ergonomically designed to accommodate all those special places, NEA is handy, rechargeable and exceedingly quiet. Comes included with gift box, charger, manual and a 1-year LELO warranty.NOTE: Sexual Wellness products are not returnable.",http://ecx.images-amazon.com/images/I/41TRosGOCsL._SY300_.jpg
9559000063,Mia Deep Rose Premium LELO Vibrator Massager,"Mia is a discreet lipstick shaped pleasure object carefully designed to combine discreet size and subdued sound with versatility and reach, intended for private enjoyment at all times. This elegant lipstick vibrator nestles seductively in your handbag, her size and chargeability make her available whenever needed, whether on a long intercontinental flight or during a break on a busy day. Glossy and attractive, MIA's intuitive interface buttons let you control vibration intensity and choose stimulation modes in the midst of ecstasy. USB charging with your computer is easy and convenient via the removable ""lipstick"" cap and her LED indicates use of buttons and charging activity. MIA is rechargeable and a 2-hour charge provides up to 4 hours of bliss. The best quality at the best price. Don't cut corners when it comes to your massager. When only the very best will do, buy LELO. Your MIA DEEP ROSE includes: One MIA DEEP ROSE massager, Gift box/Safe keeping box, USB extension cord for charging, User Information manual (read it to discover its other qualities), Satin carry pouch, 1 year LELO warranty.",http://ecx.images-amazon.com/images/I/21MrVXRH1gL.jpg
9576799082,"Medical Surgical Earloop Procedure Face Masks Blue with Fiberglass-Free, Box of 50","Earloop Procedure Face Masks are pleated face masks with a glass free filter, making them ideal for clinics and dental offices. Earloop Procedure Face Masks are latex free and available in boxes of 50",http://ecx.images-amazon.com/images/I/31khgZJv%2BVL.jpg
9576862833,Project E Beauty USB Skin Hair Analyser Analyzer Diagnosis Scanner Magnifier X200 Magnification a,"ISO9001:2000approved
High quality

Skin Hair Analyzer
-Easy to use
-Direct use on computer
-Simple Hair Skin Analyzer,Sanitizer,beauty equipment",http://ecx.images-amazon.com/images/I/41KEhsV73ML._SX300_.jpg
9578299621,Project A Beauty Cold Hammer Blue LED Photon Cell Activating Skin Spa Salon Therapy Massager,"What's More
Cold Therapy 
Cold should be applied for a maximum of twenty minutes which should be sufficient to produce the numbed response which is required. The process can be repeated for 5 minutes to're-numb' the area if necessary. 
1. Exercise increases blood flow to the injured area, vital in healing 
2. Exercise re-establishes neuromuscular function 
3. Exercise is possible much earlier than normal 
4. Muscular atrophy is not allowed time to set in 
5. Swelling in reduced dramatically through the combination of cooling and exercise. 
Photon Beauty Device
&#x2022; Light rays of different wavelengths: 
&#x2022; Penetrate 10 mm deep into skin
&#x2022; Low power setting
&#x2022; Temperature control
&#x2022; Time setting: automatic shut-off device
&#x2022; Signal: Beeps on change of intensity 
&#x2022; Lightweight and portable
&#x2022; Choose the model for your skin type

As we age, the top layers of our skin lose more moisture. Older skin renews itself every four to six weeks, unlike the three to four weeks for younger skin. This older skin has a dry and dehydrated condition, resulting in fine wrinkles and age spots. No one wants the troublesome burden of continuously alternating cold packs - think of the time you'd save if one device took care of both for you! We proudly introduce the Cold Spa Bar to alleviate what ails you; its applications of cold allow the skin's natural rejuvenation processes to be accelerated. Also, painful muscles are treated in a targeted way: 

PURE AND CLEAR
For this model Blue light was chosen with the aim of skin-clearing effect. The Photon Beauty LED Blue Light device uses a unique low-intensity blue photon light wavelength which may help to activate bacteria-fighting porphyries. 
PHOTON CARE 
Photon Beauty helps to revitalize cells, enhance blood circulation, increase oxygen supply, strengthen skin tissues and improve metabolism and excretion by using natural light waves that transmit into the skin .",http://ecx.images-amazon.com/images/I/41RWUhWLR-L._SX300_.jpg
960100095X,Lelo Lily Vibrator - Plum,"LILY is a discrete pleasure object with a unique silky smooth finish and deceptively powerful purr. In essence sculpted for clitoral massage, her flowing form blends effortlessly with the natural curves of the female body. The carefully engineered vibrator delivers strong sensations whilst merely emitting a whispery hum. Her sensually tactile qualities, full of toe curling promise, makes LILY an ideal companion for those lazy afternoon delights. Ergonomically designed, LILY is handy, rechargeable and a 2 hour charge will provide up to 7 hours of bliss. The best quality at the best price. Don't cut corners when it comes to your massager. When only the very best will do, buy LELO. Your LILY SWEET PLUM includes: One LILY SWEET PLUM massager, Gift box/Safe keeping box, Universal Charger (110v North America, 220v Europe/Asia etc.), User Information manual (read it to discover its other qualities), Satin carry pouch, 1 year LELO warranty.",http://ecx.images-amazon.com/images/I/31x7RZKjfJL._SY300_.jpg
9647619596,"Autumn Traditions Thanksgiving Falling Leaves ~ Plate, Napkins and Tablecloth Set Serves 24","BEAUTIFUL AUTUMN LEAVES IN RED, ORANGE, YELLOW with HINTS OF GREEN. Paper Plates & Napkins & Tablecloth Set. SET INCLUDES: 1 RECTANGLE TABLECLOTH 54"" X 96"". 18 DINNER PLATES. 40 DESSERT PLATES. 40 NAPKINS. 105 PIECE SET. MADE IN THE USA!",http://ecx.images-amazon.com/images/I/51sRX3GAPaL._SX300_.jpg
9681500717,Moulding Motion 5 + Free Reducer Gel Weight Loss,Help to reduce the body fat.,http://ecx.images-amazon.com/images/I/4133RUj1trL._SX300_.jpg
9742778965,Feather Double Edge Shaving Razor Wine No.s2 Free 1 Blade Razor,Feather Double Edge Shaving Razor Wine No.s2,http://ecx.images-amazon.com/images/I/51PiVnl5vJL._SY300_.jpg
9747590972,Bepanthen First Aid Cream 30 G,Bepanthen First Aid Cream 30 G,http://ecx.images-amazon.com/images/I/41N-7duX%2BwL._SX300_.jpg
974929341X,SCHERIPROCT N CREAM X 10 GM,SCHERIPROCT n Cream X 10 GM,http://ecx.images-amazon.com/images/I/41XeeUckxuL._SY300_.jpg
9749628926,,,
9758631012,Tarblock Cigarette Filters For Smokers 5 Packs,"Tarblock Cigarette Filters are the latest innovation in helping people who smoke to cut out up to 90% of the tar in cigarette smoke. Developed by scientists, this product is a must for anyone who smokes or who would like to take care of the loved ones addicted to smoking.

Tarblock is a plastic mechanical filter that goes on your cigarette filter. By using Tarblock you can limit the amount of cancer causing tar and other chemicals from entering your lungs and body while you smoke. Does not fit the very slim type cigarette.

Do something good for yourself that may not only help you feel better but it can provide something positive untill or if you decide to quit smoking in the future. Health care product created for the convenience of people of legal age who already smoke or are trying to cut down on smoking, or wish to have a better smoking experience. 

30 filters per pack. Each filter is good for 5 regular or 8 light cigarettes, depending how you smoke. This is tiny device but yet very effective.",http://ecx.images-amazon.com/images/I/51E8Xf9VxUL._SY300_.jpg
978980833X,Remote Control 10-Function Little Black Panty - Thong,Stretch-to-fit sexy lace thong/panty with adjustable satin ties and a secret pocket for secure bullet placement,http://ecx.images-amazon.com/images/I/41SlfZ5RdaL._SY300_.jpg
9790772890,TERRE D'HERMES by Hermes (MEN) DEODORANT STICK 2.6 OZ,"Terre d'Hermes Deodorant Stick for Men 2.6 oz The history of an alchemy, a journey through the elements: earth, air and water",http://ecx.images-amazon.com/images/I/21Xxj-IuO6L.jpg
9790780486,ETERNITY By Calvin Klein For Men AFTER SHAVE BALM 3.4 OZ,"DESIGN HOUSE - Calvin Klein. YEAR INTRODUCED - 1989. FRAGRANCE NOTES - greens, crisp jasmine, sage, basil, and rosewood, very refreshing and crisp. RECOMMENDED USE - daytime",http://ecx.images-amazon.com/images/I/51n7WA86y-L.gif
9839215035,Nu Skin NuSkin Pharmanex BioGinkgo 27/7 (1 Bottle = 60 Tablets),"I am an authorized Nu Skin Distributor and only sell NU SKIN products 
BENEFITS
Stimulates memory and concentration*
Promotes circulation to the brain, arms, and legs*
Natural antioxidant that may help support the antioxidant defense system in fighting free radicals*
BioGinko promotes normal healthy memory and concentration. BioGinkgo 27/7 is an exclusive extra strength preparation of ginkgo biloba leaf extract for the maintenance of healthy cognitive performance and circulatory health.",http://ecx.images-amazon.com/images/I/51VDSdLstWL._SY300_.jpg
9839214993,NuSkin Nu Skin Pharmanex Nano CoQ10 (1 Bottle = 30 Capsules),"Coenzyme Q10 (CoQ10) helps produce energy at the cellular level to nutritionally support the body's major tissues and organs and to provide anti-aging benefits. CoQ10 supports heart health, and helps protect brain cells, an important factor in preserving mental function. Since CoQ10 is a powerful antioxidant and ""recycles"" vitamins C and E, it supports the entire antioxidant network in the skin and throughout the body. NanoCoQ10TM is a proprietary form of CoQ10 that utilizes breakthrough monomolecular encapsulation technology to wrap each CoQ10 molecule in an easily absorbable carbohydrate ring. Preliminary research suggests that nano technology dramatically improves bioavailability.*

As a dietary supplement take one (1) capsule daily with food.",http://ecx.images-amazon.com/images/I/41L5YFVPU3L._SY300_.jpg
9839214969,Nu Skin / Pharmanex Estera II Transitional Formula for Women,Estera Phase II is designed for women during perimenopausal years. Transition Formula ingredients work with the liver to promote a healthy ratio of estrogen metabolites and to help relieve menopause symptoms,http://ecx.images-amazon.com/images/I/31VBbl%2B09DL._SX300_.jpg
9895507569,TARBUSH FEZ HAT - Authentic Ottoman Turkish Turkey Moroco Egypt - New,"FEZ TARABUSH HAT - This brand new FEZ (FES), a symbol of Ottoman Empire, is manufactured in Istanbul, Turkey. The hat is in the shape of a truncated cone; a black tassel hangs from the crown and it bears gold colored decorations. It is a decoration piece which would be a great gift, as well as a hat to wear in special occasions. GREAT ACCESSORY FOR THAT FAB FANCY DRESS COSTUME!!!!",http://ecx.images-amazon.com/images/I/51M7s8v4qsL._SX300_.jpg
9895506724,Aristo Stylish Full Frame Italian Modern Pattern Design Reading Glasses Aspheric Lens Black +2.5,*Aristo Quality Brand. *Full Frame Modern Reading Glasses * Light Glasses - Thin Aspheric Lenses. *Color & Size : See the Title for details. *Italian Design.,http://ecx.images-amazon.com/images/I/412134gJM4L._SX300_.jpg
9895506244,Unisex 20mm Casual Elastic Suspender Braces with Leather Junction - Red - New in Box,"The braces packed and dispatch in a fancy gift box!!! This braces are brand new. This retro hot style has recently been spotted on celebrities and are current out in all the high street stores. Unisex Green suspenders. 20mm width. leather junction & 3 clips. FULLY ADJUSTABLE AND HAVE SILVER CLIPS AND ADJUSTERS. SIZE MULTIFIT WITH WILL FIT UP TO AT LEAST 44""/110cm.",http://ecx.images-amazon.com/images/I/51zaieMJ-1L._SY300_.jpg
9895504411,Aristo Full Frame Reading Glasses Replaceable Aspheric Lenses Ultra Thin Anti Slide White / Orange +2.5,*Aristo Quality Brand. *Full Frame Reading Glasses with Replaceable Lenses . *You can Take off the Lenses and Add your own Lenses. *Ultra Light Glasses - Ultra Thin Aspheric Lenses. *Glasses can be held anywhere using its elastic anti slide holders. *Color & Size : See the Title for details. *Comes with a a protection bag.,http://ecx.images-amazon.com/images/I/31qE86DceKL._SX300_.jpg
9895506236,Unisex 20mm Casual Elastic Suspender Braces with Leather Junction - Dark Blue - New in Box,"The braces packed and dispatch in a fancy gift box!!! This braces are brand new. This retro hot style has recently been spotted on celebrities and are current out in all the high street stores. Unisex Green suspenders. 20mm width. leather junction & 3 clips. FULLY ADJUSTABLE AND HAVE SILVER CLIPS AND ADJUSTERS. SIZE MULTIFIT WITH WILL FIT UP TO AT LEAST 44""/110cm.",http://ecx.images-amazon.com/images/I/51kpTOIfooL._SY300_.jpg
9895514166,Shema Israel Circle Kabbalah White String Cord Bracelet Against Evil Eye K-62,"Kabbalah Bracelets. White leather string. Rhodium finished. Lobster clasp. Shema Israel Pendant. It is written in Hebrew text of the basic Jewish creed: Shema Yisrael, Hashem Elokeinu, Hashem Echad (Hear, O Israel, Hashem is our God, Hashem is One) (Deuteronomy 6:4). God's name is not spelled out on the pendant, to avoid desecration.",http://ecx.images-amazon.com/images/I/41JmS2YZsWL._SY300_.jpg
9895504446,Aristo Full Frame Reading Glasses Replaceable Aspheric Lenses Ultra Thin Anti Slide Brown / Orange +2.0,*Aristo Quality Brand. *Full Frame Reading Glasses with Replaceable Lenses . *You can Take off the Lenses and Add your own Lenses. *Ultra Light Glasses - Ultra Thin Aspheric Lenses. *Glasses can be held anywhere using its elastic anti slide holders. *Color & Size : See the Title for details. *Comes with a a protection bag.,http://ecx.images-amazon.com/images/I/41lcF2IeYqL._SX300_.jpg
9895507496,35mm Casual Elastic Men Suspender Braces Black with Brown Leather Junction Suspender Braces Model #1,"Mens Black & Brown Suspenders/Braces. 35mm width. Brown Leather Junction & 3 Clips. FULLY ADJUSTABLE AND HAVE SILVER CLIPS AND ADJUSTERS. SIZE MULTIFIT WITH WILL FIT UP TO AT LEAST 44""/110cm.",http://ecx.images-amazon.com/images/I/51s3XBMKbuL._SY300_.jpg
9895514301,30cm/12&quot; Kabbalah Metal &amp; Glass Moroccan Gold Decorations and Large Evil Eye Lucky Charm Wall/Car/Window Decor Protection,"* Wall/car/window hanging protection charm * Mesurements: 28cm/17"" high, 5cm/1.9"" width * Rhodium finished * Metal base, glass heart and plastic beads",http://ecx.images-amazon.com/images/I/41I0UFVVSYL._SY300_.jpg
9895514107,Hamsa Hand Kabbalah Red Thread Leather With Zircon Bracelet Evil Eye K-68,"Kabbalah Bracelets. Pendant charm is 20mm x 10mm. Leather. Lobster clasp. Rhodium finished. With HAMSA - An alternative Jewish name for it is the Hand of Miriam, in reference to Miriam, the sister of Moses and Aaron as well as the Hamesh Hand. It serves as an ancient talismanic way of averting and getting protection from the evil eye, or more generally of providing a protecting hand or Hand of God. Wearing a thin red string (as a type of talisman) is a custom associated with Judaism's Kabbalah in order to ward off misfortune brought about by an ""evil eye"".",http://ecx.images-amazon.com/images/I/41b0tOQuuLL._SX300_.jpg
989550375X,GOLD MEZUZA STYLE Kabbalah Evil Eye Black Leather Cord Bracelet,**MEZUZA Kabbalah Bracelets. **Leather string. **Lobster clasp,http://ecx.images-amazon.com/images/I/41vAOhF-UuL._SY300_.jpg
9895517726,"Amazing Bracelet with Green Jade Natural Stone Jewelry, Pewter Cross with Jesus &amp; Icon of Joseph, Maria &amp; Baby Jesus","Amazing Bracelet with Natural Stone Jewelry Decorated with Stone Style Pearls, Pewter Cross with Jesus & Icon of Baby Jesus. SIZE of the bracelet 11cm Total Lenght / 8cm Lenght for the Arm - Fits most hands.",http://ecx.images-amazon.com/images/I/41GBoHjKOvL._SY300_.jpg
9895516983,Italian Blue Jade &amp; Gold Plated GF Cross Crucifix Pendant Necklace,The cross pendant made from stone look exactly like Jade. Crucifix: 4 stone on metal frame. Made in: Italy.,http://ecx.images-amazon.com/images/I/41vW4uu0NNL._SY300_.jpg
9895507259,Rose Pink Glass Beads Holy Pray Rosary Pewter Crucifix Cross Jerusalem Inri Model #2,"You are looking at this beautiful Glass rosary with pewter cross pendant. The glass beads made in Italy so high quality is guaranteed. Rosary- 45cm length from the cross to the end Pewter Cross- 4.5cm in hight This rosary composed in Jerusalem, the beads made in italy. You can wear it or hold in your hand. Comes is a beautiful gift bag",http://ecx.images-amazon.com/images/I/41%2B3LDDZOxL._SY300_.jpg
9895506791,Aristo Classic Metal Semi Rimless Reading Glasses Replaceable Aspheric Lenses Black +1.5,*Aristo Quality Brand. *Semi Rimless Classic Reading Glasses * Metal Glasses - Thin Aspheric Lenses. *Color & Size : See the Title for details. *Italian Design.,http://ecx.images-amazon.com/images/I/31MdbOWhUTL._SX300_.jpg
9895506228,Unisex 20mm Casual Elastic Suspender Braces with Leather Junction - Black - New in Box,"The braces packed and dispatch in a fancy gift box!!! This braces are brand new. This retro hot style has recently been spotted on celebrities and are current out in all the high street stores. Unisex Green suspenders. 20mm width. leather junction & 3 clips. FULLY ADJUSTABLE AND HAVE SILVER CLIPS AND ADJUSTERS. SIZE MULTIFIT WITH WILL FIT UP TO AT LEAST 44""/110cm.",http://ecx.images-amazon.com/images/I/51PawDYUXDL._SY300_.jpg
9895516770,"7 In One Holy Water, Soil, Oil, Cross, Incense, Candle &amp; Icon Big Jerusalem Set from the Holy Land","This decorative box containing: - Olive Oil from Bethlehem with blassing of Church of Nativity Bethlehem. - Holy Soil from Jerusalem. - Holy water from the Jordan River. - Incense that contained essence of flowers and tree from the holy-land. - Wood hand-made crucifix with pewter figure of the Son. - Holy Candle. - Icon & Certificate- Icon can be different, each set comes with different icon!. * THE BOX IS 21X17cm. * EACH BOTTLE IS 5cm HIGH. * THE CROSS IS 10cm HIGH.",http://ecx.images-amazon.com/images/I/51%2B0PlQfMmL._SY300_.jpg
9895515405,Hematite Round Beads Chaplet Rosary with Jesus Crucifix &amp; Jerusalem Cross,"You are looking at Hematite Gemstone beads Bracelets. You will get one with round beads and one with oval beads as shown in the picture above. The beads are real hematite and the metal parts made of pewter. Length from Top to Bottom - 16cm / 6.2""",http://ecx.images-amazon.com/images/I/31FQIc9TinL._SY300_.jpg
989550702X,Star of David Magen David Kabbalah Red Leather Thread String Bracelet Evil Eye,Kabbalah Bracelet. pendant is 25mm in length. rohdium finish. lobster clasp. leather string.,http://ecx.images-amazon.com/images/I/410zLkc8zhL._SX300_.jpg
9895506368,GOLD MEZUZA STYLE Evil Eye Kabbalah Red Leather Cord Bracelet,**MEZUZA Kabbalah Bracelets. **Leather string. **Lobster clasp,http://ecx.images-amazon.com/images/I/41xiAKFQ0ML._SY300_.jpg
9895513712,Olive wood beads Rosary made with Silver our Father beads and Soil Rosary Center from the Holy Land,,http://ecx.images-amazon.com/images/I/51tCYh0AVXL._SY300_.jpg
9895506805,Aristo Classic Metal Semi Rimless Reading Glasses Replaceable Aspheric Lenses Black +2.0,*Aristo Quality Brand. *Semi Rimless Classic Reading Glasses * Metal Glasses - Thin Aspheric Lenses. *Color & Size : See the Title for details. *Italian Design.,http://ecx.images-amazon.com/images/I/31MdbOWhUTL._SX300_.jpg
9895514247,23cm/9&quot; Kabbalah Metal &amp; Glass Flipping Diamond Rhombus Evil Eye Lucky Charm Wall/Car/Window Decor Protection,"* Wall/car/window hanging protection charm * Mesurements: see title * Rhodium finished * Metal base, glass heart and plastic beads",http://ecx.images-amazon.com/images/I/31%2Bp%2BOco7DL._SY300_.jpg
9895507372,44cm Red Crystal Beads Silver Plated Rosary Necklace Cross Crucifix with Maria Center From the Holy Land,"* Crystal beads rosary * Silver plated * Maria Center piece, each bead 8mm approx * 44cm/17"" from cross to top * Made in Italy",http://ecx.images-amazon.com/images/I/41u-XN7cDiL._SY300_.jpg
9895515391,Hematite Oval Beads Bracelet Rosary Silver Plated Jesus Crucifix &amp; Holy Land Soil Capsule with Maria and Baby Jesus Icon,"Hematite Oval Beads Bracelet Rosary Silver Plated Jesus Crucifix & Holy Land Soil Capsule with Maria and Baby Jesus Icon. Cross is 1""/2.56c long and is stamped with word Jerusalem on back.",http://ecx.images-amazon.com/images/I/31k5igHhE9L._SY300_.jpg
9984293785,Erotic 40 Incense Sticks with Free Wood Incense Holder,"Erotic incense is the perfect incense to help you create an intimate atmosphere. It delivers a subtle scent with a strong message. Perfect for romantic evenings, this incense has been hand-rolled in India by HEM Corporation and is ready to be burned in your area to create your perfect Erotic environment",http://ecx.images-amazon.com/images/I/41WRNuJIKtL._SX300_.jpg
9984293068,Black Leather Adjustable To any size Peace Sign Bracelet,,http://ecx.images-amazon.com/images/I/21cepG-akcL.jpg
9984293017,Magnetic Hematite Black Beads Bracelet Necklace,you can wear it as a bracelet or a necklace,http://ecx.images-amazon.com/images/I/41Z95YOeGAL._SY300_.jpg
B00000007I,Four O'Clock Balloon,,http://ecx.images-amazon.com/images/I/512Dcb74NsL._SY300_.jpg
B0000001YB,Elimination,,http://ecx.images-amazon.com/images/I/31CCQ9E159L.jpg
B00000020Q,Deep Dark Ocean,,http://ecx.images-amazon.com/images/I/41QTZRCD74L.jpg
B0000003X6,Feather River,,http://ecx.images-amazon.com/images/I/51D2IbrQi%2BL._SY300_.jpg
B000000EIC,Patrick Sky,"Vanguard is finally re-issuing this '60s folkie after repeated requests from fans and critics! This is his first (1965) album, which includes Rattlesnake Mountain; Many a Mile; Reuben; Nectar of God , and more.",http://ecx.images-amazon.com/images/I/51X6YAX78WL._SX300_.jpg
B000000GG7,First Recordings,,http://ecx.images-amazon.com/images/I/21MHAGD4EBL.jpg
B0000012IC,Cryogenic Sleep,"1. Khz Pt. 2
2. Make It Go Away
3. Hear You
4. Fly On The Windscreen
5. When There Is Nothing
6. Trance Pt. 3
7. Feel Me
8. Accelerator Pts. 1 & 2
9. Lethargic
10. Anxiety Attack
11. Metal
12. I'm Here
13. Floccipaucinihilipilification",http://ecx.images-amazon.com/images/I/11fO2NjOdIL._SL500_.jpg
